start_time_sec,end_time_sec,annotation
2.2,2.6,Nej
8.9,10.099,Hej jag heter Salma
10.4,11.099,Vad heter du
14.5,14.9,Heter det
19.3,20.3,ökade den då
22.399,24.399,Har du läst det första dilemmat
30.3,30.8,Absolut
31.399,36.1,Frågan är om man ska införa robotdomare för att döma
36.6,41.6,Diverse brott att fylla då får använda människor som domare
46.399,47.5,Har du förstått vad jag säger
50.28,50.76,ja
51.399,52.799,Vad har du för spontana tankar
65.299,66.0,Då gick det
73.099,77.299,Tycker du att det är viktigare att vara snabbare eller att det blir ett bra beslut
81.92,86.7,Men du tänker att man kan göra bra beslut och vara snabb samtidigt
89.299,92.4,På vilket sätt hade det gått snabbare om en robot hade fått ta över
107.9,111.299,Hur tänker du att den roboten har tränats för att kunna göra det
117.599,120.9,En del av frågan var att man skulle använda tidigare domar
121.4,125.5,för att komma upp med någon form av databas för robotarna att ta sådana beslut
126.5,127.099,Eh
127.5,130.699,Och sen så sa de att roboten i sig kan vara mindre
131.699,134.3,Alltså rasistisk sexistisk etcetera
134.9,141.5,Men inte av den byggd på tidigare domar tänker jag som oftast är sexistiska eller whatever de kan vara
142.199,143.0,Är det biased
143.9,144.9,Vad tänker du Pingde
170.8,176.699,Jag vet inte ens för vem är det då som kommer att tjäna kan man säkerställa att de själva inte har något form av bias i sig
183.3,186.3,Jag tänker att det någonsin hade kunnat bli en perfekt dom
186.699,187.699,av en robot
195.099,197.5,Tycker att det finns en objektivt
197.699,198.5,Rätt
198.9,200.4,Dom för varje brott
206.4,208.599,Nej jag tänker att det nog är mer nyanserat än så
209.9,212.8,Och att det är mycket på individbasis för många brott
213.599,214.9,Säkert att man förlorar
215.199,217.3,Vilka partier man bör använda robot
218.3,223.9,Det är både någon som väljer att mörda sin våldtäktsman och korta någon som väljer att mörda någon för att råna en bank
225.9,229.199,Jag vet inte hur en robot hade kunnat särskilja på det i alla fall just nu
231.9,232.5,Vad tänker du
245.099,247.4,Vad tänker du om robotar som advokater
251.5,255.5,Jag tror att det hade varit lättare för en robot att vara advokat än att vara domare
263.899,264.699,Jag tror att
265.1,268.199,De hade varit bättre på advokater för där är det så mycket mer
269.3,271.5,Hitta fel eller hitta
272.0,274.899,och så saker som inte stämmer som inte är ekvivalenta
275.5,277.3,Felix historier där
278.0,280.1,Så förstår jag man hade velat använda en robot
281.0,283.6,Men att själva domen i sig bör komma från en person
284.8,286.8,Jag tänker inte att robotar hittills är
287.199,289.0,Även om vi har en AIstrateg
291.199,294.399,Det är bra att se en helhetsbild för det den är
296.0,301.5,I alla fall inte ur ett mänskligt perspektiv tänker jag Men jag kan tänka mig att de hade varit användbara för advokater
309.899,312.199,Har du varit på en rättegång tidigare
315.0,315.8,Någon
316.1,317.6,Den var jättestel
318.0,321.5,För det var någon som hade snattat någonting och vi gick dit med skolan
322.5,329.699,Det var supertråkigt Det var en rätt enkel dom men den tog för evrigt Så jag tror på det du säger med att använda robotar
330.0,331.699,för att effektivisera det
332.699,333.199,Jag tycker att vi skulle ha
333.5,337.3,Jag kan ha det för mindre grova fall där det är
337.6,339.1,snarlucka fall typ
339.5,340.3,Attfälla
341.8,342.3,Kanske
345.899,351.899,Vad tycker du om att man stjäl för att man inte har pengar till att till exempel köpa mat Tänker du att man borde straffa dem
352.5,355.0,Lika mycket som någon som stjäl bara för att de har tråkigt
376.199,377.1,Denna vädergrej
377.5,379.0,Jag tror nog att jag håller med
380.3,381.5,Men sen så blir ju
382.0,383.1,åt en gråzon
384.1,387.3,Vad man har empati för
388.1,391.199,Om man växer upp i en tråkig förort och väljer att snatta
392.3,393.8,Det har man väl ändå förståelse för
394.899,396.5,Det är inte i samma mån direkt
398.1,398.699,Eller
412.5,416.5,Tycker du att det finns ett brott som svart på vitt
417.3,419.3,Oförsvarsbar
436.399,437.0,Ja
439.0,439.899,Jag håller med
440.699,441.6,Absolut
442.1,445.6,Men om man ska vara jätteämtsk och se det från deras perspektiv så tror jag inte att
446.899,450.399,Alltså det är världen ur deras perspektiv på något sätt
451.399,452.1,Um
452.699,454.1,Eller ja alltså allt
454.8,457.399,I ett samhälle bygger på vad som är förenligt med
458.199,459.6,drägligt liv för de flesta
459.899,461.399,Och att gå runt och se på
462.1,464.8,Sexualbrott som icke olagligt hade ju inte funkat
465.5,466.1,Eh
466.399,468.6,Och det skulle väl ifrån en moral kompass
469.899,470.5,Ja
470.699,474.199,Jag tänker verk men jag håller med om
475.1,476.899,Det går nog inte att motivera utifrån
477.199,478.899,individbasis och så
479.6,482.8,Man kan fortfarande välja att inte våldtala någon eller vad det är
484.0,485.199,Ja eller hur
488.3,492.0,Tänker du att mord är försvarsbart i vissa omständigheter
503.6,505.5,Jag kommer inte ihåg vad termen är för det
505.8,506.3,Det kanske
506.5,507.899,Det är väl ändå lite rå
508.8,510.3,Det kanske bara är självklart
511.5,514.1,Men jag håller med vad ska man göra då
514.299,515.399,Det är lite dumt
516.6,517.0,Eh
518.2,520.2,Tänker du att mord någonsin kan vara
520.899,523.2,rättfärdigats som en hämndaktion
546.399,549.7,Då tänker du att du har barn som blir lite förbjudna på
556.0,557.299,Tänker att det är rättfärdigat
564.6,564.96,mhm
566.6,567.5,Jo det är det
578.5,578.899,Ja
579.5,580.1,Det
580.5,581.5,Tror jag
582.1,583.6,Alltså en skillnad på
584.1,584.7,Eh
585.899,587.399,Lets säga att ett väljer och
587.899,590.299,Göra det kontra om en person väljer att ta det
591.0,592.0,egna händer
593.899,597.1,Det är säkert att rättsväsendet ska ha den makten absolut
598.2,599.799,Ja nog väldigt
